{
  "$schema": "https://json-schema.org/draft/2020-12/schema",
  "title": "Heartbeat",
  "description": "Edge worker capacity heartbeat. Request body of POST /v1/capacity/heartbeat, and the shape GET /v1/status re-exposes verbatim for each edge placement.\n\nAUTHORITY: edge/EDGE-WORKER-CONTRACT.md section 1 is the source of truth for these fields. This schema is a mechanical restatement of that table; where the two disagree, the edge contract wins and this file is the bug. Field semantics that the edge contract states in prose (R9, R11) are repeated in the descriptions below because an implementer reading only the schema must not be able to get them wrong.\n\nPRESENCE: every field is required. Unlike the catalog (where an absent key and an explicit null mean the same thing), a heartbeat is generated by a known agent on a fixed schedule: a missing key means a broken agent, not an unknown value. Unmeasured values are sent explicitly as null, or as the literal string \"unmeasured\" where the edge contract says so.",
  "type": "object",
  "additionalProperties": false,
  "required": [
    "node",
    "state",
    "gpu",
    "runtime",
    "active_model",
    "cached_models",
    "preemptible",
    "interactive",
    "ac_power",
    "cluster_reachable",
    "last_heartbeat",
    "capabilities",
    "max_context"
  ],
  "properties": {
    "node": {
      "type": "string",
      "minLength": 1,
      "maxLength": 253,
      "description": "Stable node identifier. Not necessarily the OS hostname, and deliberately not a network address. The bearer credential the node authenticates with is bound to this identifier: a heartbeat whose `node` does not match its credential is rejected 403 `node_identity_mismatch` rather than accepted for the wrong node."
    },
    "state": {
      "type": "string",
      "enum": ["AVAILABLE", "SERVING", "DRAINING", "INTERACTIVE", "OFFLINE"],
      "description": "Self-reported state. STATE OWNERSHIP IS LOCAL: the host decides, the cluster never forces a node into SERVING.\n\nAVAILABLE - idle, ready to accept work.\nSERVING - actively handling one or more inference requests.\nDRAINING - finishing in-flight requests, refusing new ones.\nINTERACTIVE - local human use has claimed the GPU; not eligible for placement.\nOFFLINE - the node reports it explicitly (e.g. a clean shutdown). The router ALSO assigns OFFLINE on its own when no heartbeat arrives inside 3x the interval; that transition is inferred from silence and never appears in a payload.\n\nINTERACTIVE and DRAINING are withdrawal mechanism 1 of 3 (see README 'Withdrawal semantics'): agent-router marks the placement ineligible immediately, on receipt."
    },
    "gpu": {
      "type": "object",
      "additionalProperties": false,
      "required": ["vendor", "model", "arch", "vram_total_gb", "vram_free_gb", "utilization_pct"],
      "properties": {
        "vendor": {
          "type": "string",
          "enum": ["amd", "nvidia", "unknown"],
          "description": "GPU vendor."
        },
        "model": {
          "type": ["string", "null"],
          "description": "GPU model string. May be the literal \"unmeasured\" when the SKU has not been established (edge contract section 4, laptop). A router MUST NOT resolve an unmeasured model to a SKU by inference."
        },
        "arch": {
          "type": ["string", "null"],
          "description": "GPU architecture, e.g. \"gfx1100\". May be the literal \"unmeasured\"."
        },
        "vram_total_gb": {
          "type": ["number", "null"],
          "minimum": 0,
          "description": "Total VRAM in GB. null means no measurement exists. A router MUST NOT satisfy a policy's min_vram_gb from a null value and MUST NOT substitute a nameplate figure for it (catalog README, 'Capacity numbers are sourced, not assumed')."
        },
        "vram_free_gb": {
          "type": ["number", "null"],
          "minimum": 0,
          "description": "Free VRAM in GB at sample time. null means no measurement exists. This is the only input to a policy's min_free_vram_gb; a null value cannot satisfy one."
        },
        "utilization_pct": {
          "type": "number",
          "minimum": 0,
          "maximum": 100,
          "description": "GPU utilization percentage at sample time. Not nullable, per the edge contract's field table. A node that cannot read utilization is out of contract; that tension is recorded in the README's open items rather than resolved by widening this type here."
        }
      }
    },
    "runtime": {
      "type": "object",
      "additionalProperties": false,
      "required": ["kind", "version", "endpoint"],
      "properties": {
        "kind": {
          "type": "string",
          "minLength": 1,
          "description": "Runtime identifier, e.g. \"llama-swap+llama.cpp\". Informational: invariant 9 keeps runtime differences behind the OpenAI-compatible contract."
        },
        "version": {
          "type": "string",
          "description": "Runtime/daemon version string."
        },
        "endpoint": {
          "type": "string",
          "minLength": 1,
          "description": "OBSERVATIONAL / STATUS METADATA ONLY (owner ruling R9). This field exists so an operator can see where a node believes it is listening. It MUST NOT become an authoritative routing target, MUST NOT cause dynamic agentgateway reconfiguration, and MUST NOT override Git-managed placement or backend topology. agentgateway backend hostnames stay Git-managed.\n\nTHREAT: a compromised edge heartbeat credential must not be able to redirect inference traffic by advertising an arbitrary endpoint. This is a security boundary, not a style preference. It pairs with R5 (x-placement is a scheduling signal, never authorization) as the two things a compromised edge or client cannot do.\n\nConsequently /v1/place never returns an endpoint: a caller receives a placement NAME and reaches it through agentgateway, never a URL from this field. No format is asserted on this string because it is never dereferenced by the control plane; placeholder forms such as \"https://<edge-host>:<edge-port>\" are legal values in documents."
        }
      }
    },
    "active_model": {
      "type": ["string", "null"],
      "description": "OWNER RULING R11 - the model currently LOADED / WARM IN THE INFERENCE RUNTIME, i.e. servable now with no load step. null when nothing is loaded.\n\nWarm, cached and absent are three different costs, and /v1/place economics depend on telling them apart. Collapsing warm into cached loses the ability to prefer a node that can answer immediately; collapsing cached into absent loses the ability to prefer a node that can load in seconds over one that must download tens of gigabytes. A model listed here is normally also present in cached_models, but a router MUST NOT assume it."
    },
    "cached_models": {
      "type": "array",
      "uniqueItems": true,
      "items": { "type": "string", "minLength": 1 },
      "description": "OWNER RULING R11 - model artifacts ALREADY PRESENT ON LOCAL STORAGE and therefore loadable WITHOUT A DOWNLOAD, but potentially still requiring model/VRAM load time. This is the middle cost between active_model (warm, zero load) and a model that appears in neither list (absent, download required). Empty array is legal and means no artifacts are resident."
    },
    "preemptible": {
      "type": "boolean",
      "description": "True if local interactive use can evict AI work on this host. Invariant 8: interactive human use of an edge host always wins, immediately, unilaterally, and with no cluster round-trip."
    },
    "interactive": {
      "type": "boolean",
      "description": "True while a human is actively using the host. state=INTERACTIVE implies this is true; the converse does not hold - a host can report interactive=true while DRAINING in-flight work before it flips to INTERACTIVE."
    },
    "ac_power": {
      "type": "boolean",
      "description": "False disqualifies a laptop placement (edge contract section 4). A battery-powered host advertises nothing."
    },
    "cluster_reachable": {
      "type": "boolean",
      "description": "The node's own view of whether it can reach the cluster, at its last self-check. A heartbeat that arrives asserts reachability by construction, so false here means the node's own probe failed (or the heartbeat is a replay of a buffered sample); the router SHOULD treat the node as ineligible for placement until a heartbeat reports true."
    },
    "last_heartbeat": {
      "type": "string",
      "format": "date-time",
      "description": "RFC 3339 timestamp STAMPED BY THE EDGE HOST, not by the router. The router records its own receipt time separately; the two differing is a clock-skew signal, not an error."
    },
    "capabilities": {
      "type": "array",
      "uniqueItems": true,
      "items": {
        "type": "string",
        "enum": ["chat", "tools", "vision", "audio"]
      },
      "description": "Capabilities this node's current runtime provides. Same vocabulary as the catalog's models[].capabilities, so a heartbeat can be checked against a profile's guaranteed capability floor without translation. vision and audio are INPUT modalities."
    },
    "max_context": {
      "type": "integer",
      "minimum": 1,
      "description": "Context window in tokens that this node currently serves. Checked against a profile's min_context guarantee."
    }
  },
  "allOf": [
    {
      "description": "state=INTERACTIVE means a human has claimed the GPU, so interactive must agree. The reverse is deliberately not constrained.",
      "if": {
        "properties": { "state": { "const": "INTERACTIVE" } },
        "required": ["state"]
      },
      "then": {
        "properties": { "interactive": { "const": true } }
      }
    }
  ]
}
