{
  "node": "<edge-node-laptop>",
  "state": "AVAILABLE",
  "gpu": {
    "vendor": "nvidia",
    "model": "unmeasured",
    "arch": "unmeasured",
    "vram_total_gb": null,
    "vram_free_gb": null,
    "utilization_pct": 0
  },
  "runtime": {
    "kind": "llama-swap+llama.cpp",
    "version": "llama-swap 1.4.0 / llama.cpp CUDA b9917",
    "endpoint": "https://<edge-host>:<edge-port>"
  },
  "active_model": null,
  "cached_models": [],
  "preemptible": true,
  "interactive": false,
  "ac_power": false,
  "cluster_reachable": true,
  "last_heartbeat": "2026-08-19T15:02:41Z",
  "capabilities": ["chat"],
  "max_context": 8192
}
