{
  "node": "<edge-node-1>",
  "state": "DRAINING",
  "gpu": {
    "vendor": "amd",
    "model": "RX 7900 XTX",
    "arch": "gfx1100",
    "vram_total_gb": 24,
    "vram_free_gb": 2.4,
    "utilization_pct": 88
  },
  "runtime": {
    "kind": "llama-swap+llama.cpp",
    "version": "llama-swap 1.4.0 / llama.cpp ROCm b9917",
    "endpoint": "https://<edge-host>:<edge-port>"
  },
  "active_model": "qwen3.6-27b",
  "cached_models": ["qwen3.6-27b"],
  "preemptible": true,
  "interactive": true,
  "ac_power": true,
  "cluster_reachable": true,
  "last_heartbeat": "2026-08-19T15:01:12Z",
  "capabilities": ["chat", "tools"],
  "max_context": 65536
}
